{
  "$schema": "https://json-schema.org/draft/2020-12/schema",
  "$id": "https://zero-ops-sre-recipe.contracts/schemas/tool-policy.schema.json",
  "title": "Tool policy",
  "description": "Deny-by-default, deny-wins, fail-closed. This layer is defence in depth and is not the authority: the read-only guarantee is the RBAC grant that Azure Resource Manager enforces (SEC-001). The policy is declared here and is not framework-enforced, so its limits are verified by the post-deployment posture check rather than asserted locally (FR-53). It names capability classes, never the tool identifiers of a pinned runtime version.",
  "type": "object",
  "additionalProperties": false,
  "required": [
    "schemaVersion",
    "name",
    "defaultDecision",
    "conflictResolution",
    "onEvaluationFailure",
    "allowedCapabilityClasses",
    "denyRules",
    "executionLimits",
    "retryPolicy"
  ],
  "properties": {
    "schemaVersion": { "$ref": "#/$defs/schemaVersion" },

    "name": { "$ref": "#/$defs/identifier" },

    "defaultDecision": {
      "type": "string",
      "enum": ["deny"],
      "const": "deny",
      "description": "Pinned to deny. A capability absent from the allow list is denied because nothing granted it, not because a rule caught it. This is why an unrecognised capability cannot arrive permitted."
    },

    "conflictResolution": {
      "type": "string",
      "enum": ["denyWins"],
      "const": "denyWins",
      "description": "Pinned. Where an allow and a deny both match, deny takes effect. Stated explicitly because the opposite convention exists elsewhere and a silent difference here would be a permission escalation."
    },

    "onEvaluationFailure": {
      "type": "string",
      "enum": ["deny"],
      "const": "deny",
      "description": "Pinned to deny. A policy that cannot be evaluated must not resolve to permitted. Fail-open is inexpressible rather than discouraged."
    },

    "allowedCapabilityClasses": {
      "type": "array",
      "uniqueItems": true,
      "description": "Required, and required even when empty. An empty list denies everything and says so; an absent list would be read as 'unrestricted' by anything that treats absence as a wildcard (NEG-D).",
      "items": { "$ref": "#/$defs/capabilityClass" }
    },

    "denyRules": {
      "type": "array",
      "uniqueItems": true,
      "minItems": 7,
      "description": "Every one of the seven categories FR-52 names must carry an explicit deny rule. minItems together with uniqueItems and a seven-member enumeration is what forces all seven to be present: with fewer than seven distinct members the instance cannot satisfy both constraints. Explicit denial is redundant against defaultDecision on purpose, so that removing the allow list does not quietly remove the prohibition.",
      "items": { "$ref": "#/$defs/denyRule" }
    },

    "retryPolicy": {
      "type": "object",
      "additionalProperties": false,
      "required": ["maxAttempts", "backoff"],
      "description": "How a retryable failure is repeated. Which failure classes are retryable is not declared here and cannot be: retryability is a property of the class, fixed by the contract, and a policy that could mark a denied grant retryable would turn a settled finding into a loop. This declares only how many times and how far apart (FR-07).",
      "properties": {
        "maxAttempts": {
          "type": "integer",
          "minimum": 1,
          "maximum": 100,
          "description": "Including the first. A ceiling of 1 means no retry, which is a policy and not an absence, so the two are distinguishable."
        },
        "backoff": {
          "type": "string",
          "enum": ["none", "fixed", "exponential"],
          "description": "The spacing between attempts. Closed, because a free-form expression would be a schedule the framework cannot reason about and the posture check cannot compare against what the runtime holds."
        },
        "initialDelaySeconds": {
          "type": "integer",
          "minimum": 0,
          "maximum": 3600,
          "description": "The first interval. Meaningful for fixed and exponential; a zero delay with no backoff repeats immediately, which is the honest representation of a retry that waits for nothing."
        }
      },
      "allOf": [
        {
          "if": {
            "properties": { "backoff": { "const": "none" } },
            "required": ["backoff"]
          },
          "then": {
            "not": { "required": ["initialDelaySeconds"] },
            "description": "A delay declared alongside no backoff is two contradictory claims about the same schedule."
          },
          "else": {
            "required": ["initialDelaySeconds"],
            "description": "A backoff strategy with no interval does not describe a schedule."
          }
        }
      ]
    },

    "executionLimits": {
      "type": "object",
      "additionalProperties": false,
      "required": [
        "maxToolCalls",
        "maxWallClockSeconds",
        "maxResultSetRows",
        "perQueryTimeoutSeconds"
      ],
      "description": "All four limits FR-53 enumerates. Declared, not framework-enforced: enforcement belongs to the agent runtime, and the framework does not assert what it cannot observe. The posture check reports the limits the runtime actually holds and fails on a mismatch.",
      "properties": {
        "maxToolCalls": { "type": "integer", "minimum": 1 },
        "maxWallClockSeconds": { "type": "integer", "minimum": 1 },
        "maxResultSetRows": { "type": "integer", "minimum": 1 },
        "perQueryTimeoutSeconds": { "type": "integer", "minimum": 1 }
      }
    },

    "description": { "type": "string", "maxLength": 500 }
  },

  "$defs": {
    "schemaVersion": {
      "type": "string",
      "const": "1.0.0",
      "pattern": "^[0-9]+\\.[0-9]+\\.[0-9]+$",
      "description": "The version of this schema the instance conforms to (FR-05, FR-29). Pinned with const rather than left to the pattern: without it an instance could declare any version at all and still validate, which made the declaration decorative (NFR-21)."
    },
    "identifier": {
      "type": "string",
      "pattern": "^[a-z][a-z0-9-]{1,62}[a-z0-9]$",
      "description": "Lowercase, hyphen-separated. Constrained so an identifier cannot carry arbitrary text, and English by construction (FR-03, CON-01)."
    },
    "capabilityClass": {
      "type": "string",
      "enum": [
        "readResourceMetadata",
        "readResourceConfiguration",
        "readMetrics",
        "readLogs",
        "readAlerts",
        "readCostData",
        "runCataloguedQuery"
      ],
      "description": "The same closed set the agent definition uses. Read-shaped only. Arbitrary query construction has no class here, which is how it is denied structurally rather than filtered at run time (NEG-C)."
    },
    "denyRule": {
      "type": "object",
      "additionalProperties": false,
      "required": ["category", "justification"],
      "properties": {
        "category": {
          "type": "string",
          "enum": [
            "write",
            "destructiveOperation",
            "arbitraryExecution",
            "secretsAccess",
            "selfApproval",
            "externalPublication",
            "agentCreatedSchedule"
          ],
          "description": "The seven categories FR-52 enumerates. A closed enumeration, so a deny rule cannot be written for an eighth category that no negative test covers, and the seven cannot be renamed apart from the tests that assert them."
        },
        "justification": {
          "type": "string",
          "minLength": 1,
          "maxLength": 500,
          "description": "Why the category is denied. Required so the policy remains reviewable by someone who did not write it."
        }
      }
    }
  }
}
